{
  "$schema": "../../node_modules/@effect/docgen/schema.json",
  "srcDir": "src",
  "outDir": "docs",
  "srcLink": "https://github.com/kriegcloud/beep-effect/tree/main/tooling/build-utils/src/",
  "exclude": ["src/internal/**/*.ts"],
  "examplesCompilerOptions": {
    "noEmit": true,
    "strict": true,
    "skipLibCheck": true,
    "moduleResolution": "Bundler",
    "module": "ES2024",
    "target": "ES2024",
    "lib": ["ES2024", "DOM", "DOM.Iterable"],
    "paths": {
      "@beep/build-utils": ["./src/index.ts"],
      "@beep/build-utils/*": ["./src/*"],
      "@beep/identity": ["../../packages/common/identity/src/index.js"],
      "@beep/identity/*": ["../../packages/common/identity/src/*.js"],
      "@beep/invariant": ["../../packages/common/invariant/src/index.js"],
      "@beep/invariant/*": ["../../packages/common/invariant/src/*.js"],
      "@beep/utils": ["../../packages/common/utils/src/index.js"],
      "@beep/utils/*": ["../../packages/common/utils/src/*.js"],
      "@beep/schema": ["../../packages/common/schema/src/index.js"],
      "@beep/schema/*": ["../../packages/common/schema/src/*.js"],
      "@beep/constants": ["../../packages/common/constants/src/index.js"],
      "@beep/constants/*": ["../../packages/common/constants/src/*.js"],
      "@beep/tooling-utils": ["../utils/src/index.js"],
      "@beep/tooling-utils/*": ["../utils/src/*.js"]
    }
  }
}
