{
  "$schema": "../../../node_modules/@effect/docgen/schema.json",
  "srcDir": "src",
  "outDir": "docs",
  "srcLink": "https://github.com/kriegcloud/beep-effect/tree/main/packages/iam/infra/src/",
  "exclude": [
    "src/internal/**/*.ts"
  ],
  "examplesCompilerOptions": {
    "noEmit": true,
    "strict": true,
    "skipLibCheck": true,
    "moduleResolution": "Bundler",
    "module": "ES2022",
    "target": "ES2022",
    "lib": [
      "ES2022",
      "DOM",
      "DOM.Iterable"
    ],
    "paths": {
      "@beep/iam-infra": [
        "./src/index.ts"
      ],
      "@beep/iam-infra/*": [
        "./src/*"
      ],
      "@beep/types": [
        "../../common/types/src/index.js"
      ],
      "@beep/types/*": [
        "../../common/types/src/*.js"
      ],
      "@beep/shared-tables": [
        "../../shared/tables/src/index.js"
      ],
      "@beep/shared-tables/*": [
        "../../shared/tables/src/*.js"
      ],
      "@beep/schema": [
        "../../common/schema/src/index.js"
      ],
      "@beep/schema/*": [
        "../../common/schema/src/*.js"
      ],
      "@beep/invariant": [
        "../../common/invariant/src/index.js"
      ],
      "@beep/invariant/*": [
        "../../common/invariant/src/*.js"
      ],
      "@beep/utils": [
        "../../common/utils/src/index.js"
      ],
      "@beep/utils/*": [
        "../../common/utils/src/*.js"
      ],
      "@beep/constants": [
        "../../common/constants/src/index.js"
      ],
      "@beep/constants/*": [
        "../../common/constants/src/*.js"
      ],
      "@beep/shared-domain": [
        "../../shared/domain/src/index.js"
      ],
      "@beep/shared-domain/*": [
        "../../shared/domain/src/*.js"
      ],
      "@beep/errors/client": [
        "../../common/errors/src/client.js"
      ],
      "@beep/errors/shared": [
        "../../common/errors/src/shared.js"
      ],
      "@beep/errors/server": [
        "../../common/errors/src/server.js"
      ],
      "@beep/iam-domain": [
        "../domain/src/index.js"
      ],
      "@beep/iam-domain/*": [
        "../domain/src/*.js"
      ],
      "@beep/iam-tables": [
        "../tables/src/index.js"
      ],
      "@beep/iam-tables/*": [
        "../tables/src/*.js"
      ],
      "@beep/shared-infra": [
        "../../shared/infra/src/index.js"
      ],
      "@beep/shared-infra/*": [
        "../../shared/infra/src/*.js"
      ],
      "@beep/identity": [
        "../../common/identity/src/index.js"
      ],
      "@beep/identity/*": [
        "../../common/identity/src/*.js"
      ]
    }
  }
}