{
  "$schema": "../../../node_modules/@effect/docgen/schema.json",
  "srcDir": "src",
  "outDir": "docs",
  "srcLink": "https://github.com/kriegcloud/beep-effect/tree/main/packages/comms/server/src/",
  "exclude": [
    "src/internal/**/*.ts"
  ],
  "examplesCompilerOptions": {
    "noEmit": true,
    "strict": true,
    "skipLibCheck": true,
    "moduleResolution": "Bundler",
    "module": "ES2024",
    "target": "ES2024",
    "lib": [
      "ES2024",
      "DOM",
      "DOM.Iterable"
    ],
    "paths": {
      "@beep/comms-server": [
        "./src/index.ts"
      ],
      "@beep/comms-server/*": [
        "./src/*"
      ],
      "@beep/comms-domain": [
        "../domain/src/index.js"
      ],
      "@beep/comms-domain/*": [
        "../domain/src/*.js"
      ],
      "@beep/comms-tables": [
        "../tables/src/index.js"
      ],
      "@beep/comms-tables/*": [
        "../tables/src/*.js"
      ],
      "@beep/shared-server": [
        "../../shared/server/src/index.js"
      ],
      "@beep/shared-server/*": [
        "../../shared/server/src/*.js"
      ],
      "@beep/shared-domain": [
        "../../shared/domain/src/index.js"
      ],
      "@beep/shared-domain/*": [
        "../../shared/domain/src/*.js"
      ],
      "@beep/schema": [
        "../../common/schema/src/index.js"
      ],
      "@beep/schema/*": [
        "../../common/schema/src/*.js"
      ]
    }
  }
}