{
  "$schema": "../../../node_modules/@effect/docgen/schema.json",
  "srcDir": "src",
  "outDir": "docs",
  "srcLink": "https://github.com/kriegcloud/beep-effect/tree/main/packages/common/schema-v2/src/",
  "exclude": [
    "src/internal/**/*.ts",
    "src/experimental/contract/**/*.ts",
    "src/index.ts",
    "src/**/_id.ts"
  ],
  "parseCompilerOptions": {
    "baseUrl": ".",
    "noEmit": true,
    "strict": true,
    "skipLibCheck": true,
    "moduleResolution": "Bundler",
    "module": "ES2022",
    "target": "ES2022",
    "lib": ["ESNext", "DOM", "DOM.Iterable"],
    "allowImportingTsExtensions": true,
    "rewriteRelativeImportExtensions": true,
    "paths": {
      "@beep/schema-v2": ["./src/index.ts"],
      "@beep/schema-v2/*": ["./src/*"],
      "@beep/identity": ["../identity/src/index.ts"],
      "@beep/identity/*": ["../identity/src/*"],
      "@beep/types": ["../types/src/index.ts"],
      "@beep/types/*": ["../types/src/*"],
      "@beep/utils": ["../utils/src/index.ts"],
      "@beep/utils/*": ["../utils/src/*"]
    }
  },
  "examplesCompilerOptions": {
    "baseUrl": ".",
    "noEmit": true,
    "strict": true,
    "skipLibCheck": true,
    "moduleResolution": "Bundler",
    "module": "ES2022",
    "target": "ES2022",
    "lib": ["ESNext", "DOM", "DOM.Iterable"],
    "allowImportingTsExtensions": true,
    "rewriteRelativeImportExtensions": true,
    "paths": {
      "@beep/schema-v2": ["./src/index.ts"],
      "@beep/schema-v2/*": ["./src/*"],
      "@beep/identity": ["../identity/src/index.ts"],
      "@beep/identity/*": ["../identity/src/*"],
      "@beep/types": ["../types/src/index.ts"],
      "@beep/types/*": ["../types/src/*"],
      "@beep/utils": ["../utils/src/index.ts"],
      "@beep/utils/*": ["../utils/src/*"]
    }
  }
}
